{
  "opera_riferimento": {
    "titolo": "Le città di pianura",
    "autore": "Francesco Sossai"
  },
  "testo_prima_stesura": {
    "titolo": "Una forma di vita dopo il proprio mondo",
    "sottotitolo": "Lettura de Le città di pianura di Francesco Sossai",
    "corpo_del_testo": "## Le case che restano in piedi\n\nNella sezione centrale di *Le città di pianura*, fra una tappa e l'altra del viaggio dei tre protagonisti, le recensioni segnalano una sequenza dedicata alle abitazioni in vendita lungo il percorso. Edifici residenziali invenduti, ville recenti con il cartello *Vendesi*, architetture di provincia fissate in una disponibilità che nessuno reclama. Sembra un raccordo paesaggistico, un'inquadratura di passaggio. Probabilmente è la scena che meglio dichiara, fuori da ogni didascalia, che cosa il film stia facendo.\n\nQuelle case non sono rovine. Non sono macerie. Sono edifici che il mercato non rimuove e che il territorio non ha più la forza di sostenere come luoghi di vita: stanno in piedi, intatti, e tuttavia già fuori uso. Il Veneto attraversato dal film non è devastato; è soltanto più popolato di costruzioni che di possibilità di abitarle.\n\nDa qui parte questa lettura, perché qui sta la temperatura dell'intero film. Non la catastrofe, non la rovina improvvisa: l'erosione lenta di un mondo che continua a stare in piedi senza più sostenere ciò che vi accade.\n\n## Tre uomini in viaggio nella pianura\n\n*Le città di pianura* è il lungometraggio d'esordio di Francesco Sossai, presentato a Cannes nella sezione Un Certain Regard nel maggio 2025 e uscito nelle sale italiane nell'autunno dello stesso anno. È un road movie a tre voci, girato in pellicola 16 e 35mm, parlato in larga parte in dialetto veneto.\n\nLa storia è semplice. Carlobianchi (Sergio Romano) e Doriano (Pierpaolo Capovilla) sono due cinquantenni squattrinati, fedeli a una formula esplicita — «mai saltare l'ultimo bicchiere» — e a una geografia di bar di provincia, autogrill, periferie. Giulio (Filippo Scotti) è un giovane studente di architettura, timido, incontrato per caso in occasione di una festa di laurea. I tre si trovano a viaggiare insieme per qualche giorno attraverso la pianura veneta — fino a Venezia, fino al Memoriale Brion di Carlo Scarpa ad Altivole — sullo sfondo dell'attesa di un quarto amico, Genio, emigrato in Argentina anni prima dopo un episodio illecito legato agli scarti di una fabbrica di occhiali.\n\nIl tono è ibrido: una commedia agrodolce attraversata da un fondo malinconico, ma non funebre.\n\n## Il mondo dei due cinquantenni: una fedeltà residuale\n\nCarlobianchi e Doriano vivono integralmente dentro un codice. Bevono insieme, parlano dialetto, si orientano a memoria nella pianura, conoscono i bar giusti e i percorsi più discreti, aspettano il ritorno di Genio. La loro fedeltà a questo modo di stare al mondo non è una scelta, non è una rivendicazione, non è una resistenza politica. Non difendono il proprio mondo: lo abitano. Il codice è il tessuto stesso del loro modo di esistere — la mappa disegnata a mano contro il GPS, il dialetto contro il lessico globalizzato, il bar contro lo spazio commerciale.\n\nEppure questa fedeltà è già residuale. Carlobianchi e Doriano sono testimoni di una mediazione storica precisa — il Veneto del distretto industriale tardo-novecentesco, l'occhialeria, una socialità maschile periferica fatta di bar e di amicizia ostinata — che a un certo punto, fuori campo, ha smesso di funzionare come orizzonte di senso. L'antefatto di Genio, fuggito attorno alla crisi del 2008 dopo un episodio illecito legato al distretto occhialiero, datà nel film una soglia: prima e dopo. Carlobianchi e Doriano vivono dopo, senza che il dopo modifichi il loro modo di stare al mondo.\n\nLa scelta della pellicola analogica è coerente con questa configurazione, ed è per questo che non è citazione retrò. Il medium del film è coerente con il mondo che il film rappresenta: la grana del 16 e 35mm porta con sé un'epoca, e questa coerenza non è decorativa, è strutturale. Sossai gira il proprio Veneto con il medium del Veneto che lo ha preceduto: registra il dopo con la materia del prima. Il film non guarda il proprio oggetto da una distanza tecnologica posteriore; sta nello stesso strato.\n\n## L'ultimo bicchiere come forma del desiderio\n\nLa formula è esplicita nelle sinossi ufficiali: «mai saltare l'ultimo bicchiere». Ogni serata è l'ultima, ogni volta non lo è, e questa contraddizione è il motore stesso dell'esistenza dei due cinquantenni. Vista da fuori, è una fissazione: un investimento esclusivo nel rituale ripetuto. La tentazione di leggerla in chiave clinica — alcolismo, regressione, paura del cambiamento — è quasi automatica per uno sguardo contemporaneo abituato alla diagnosi.\n\nMa una lettura clinica sbaglierebbe l'oggetto. Carlobianchi e Doriano non sono pazienti, non sono nemmeno casi. La loro fedeltà al rituale è la forma assunta dal loro orientamento al possibile in un campo che si è eroso. Il desiderio non è una grandezza astratta che si presenta uguale in ogni vita: è sempre orientamento entro un campo, e il campo non è un dato individuale, è una mediazione storica. Quando il campo si erode — quando i capannoni si svuotano, quando le occhialerie chiudono, quando i luoghi di una socialità maschile periferica cessano di funzionare — il desiderio non scompare. Si concentra. Si concentra dove può ancora trovare appoggio: nel rituale, nella formula, nell'oggetto residuo, nella figura del quarto amico atteso.\n\nQuesta concentrazione è insieme dignitosa e problematica. Dignitosa perché custodisce un orientamento dove un orientamento sarebbe altrimenti svanito; problematica perché lo trattiene dal riconfigurarsi. Il film tiene aperta questa ambivalenza senza dirimerla, e in questo sta una delle sue qualità più rare. Nella commedia agrodolce che attraversa il viaggio, il riso non smorza la perdita: la attraversa. Non c'è elegia, non c'è funebre congedo; c'è una leggerezza che è il modo non sentimentale di reggere ciò che è già finito.\n\n## Giulio: l'incontro come prossimità\n\nGiulio entra in questa configurazione da una posizione opposta. Giovane, studente di architettura, timido, in apparente deriva esistenziale; le fonti accennano a un sentimento non dichiarato per un coetaneo nel contesto della festa di laurea iniziale. Se in Carlobianchi e Doriano il desiderio si è fissato perché il loro campo si è eroso, in Giulio si è ritratto perché un proprio campo non si è ancora costituito. Sono due forme speculari di sospensione: l'una è la conservazione di un mondo che non c'è più, l'altra è la cautela davanti a un mondo che non c'è ancora.\n\nÈ proprio questa specularità che rende il loro incontro produttivo. Il film, qui, fa una scelta precisa: non costruisce una scena del passaggio. Non c'è il momento in cui il mentore dice all'allievo che cosa pensa del mondo, non c'è la lezione, non c'è la confidenza che orienta. C'è solo un viaggio condiviso, con i suoi gesti minimi — la mappa a mano, il bicchiere, il bar — e con la sua attesa di sfondo del quarto amico.\n\nLa trasformazione di Giulio non avviene per via di insegnamento. Avviene per via di prossimità. Il giovane si trova, per qualche giorno, nel campo dei due cinquantenni, e in quel campo registra una cosa che le proprie categorie non gli avrebbero mostrato: il fatto che una forma di vita può essere pienamente abitata anche quando il mondo materiale che la sosteneva ha cessato di sostenerla. Non è la lezione che gli serve; è la condizione che gli serve. Solo a partire dal riconoscimento che la fedeltà a una forma di vita non garantisce la sua sopravvivenza, Giulio può cominciare a configurare un proprio campo.\n\n## Il Memoriale Brion: la separazione come forma\n\nIl viaggio porta i tre verso Venezia, e la tappa segnalata dalle fonti come snodo critico è la visita al Memoriale Brion di Carlo Scarpa ad Altivole. A una prima lettura, la scelta narrativa appare come riferimento colto: un giovane studente di architettura davanti a un capolavoro del Novecento veneto. La lettura qui proposta sostiene che il Brion abbia, per il film, un'altra funzione: non citazione, ma modello formale segreto.\n\nIl Memoriale Brion (1969–1978) è un'architettura che pensa la perdita come tenuta. Scarpa non costruisce un sepolcro che consoli, né un monumento che ricordi; costruisce uno spazio in cui la separazione fra i vivi e i morti è data come forma — soglia, propilea, specchi d'acqua, geometrie che dichiarano la frontiera senza pretendere di superarla. La perdita è tenuta come perdita, spazializzata. Non è simbolizzata in modo sostitutivo, non è cancellata, non è risolta.\n\nÈ probabile che *Le città di pianura* faccia, sul piano del cinema, qualcosa di analogo con la perdita di un mondo storico. Non spiega la fine del distretto veneto, non la commenta, non la giudica: la tiene come forma. La pellicola analogica, la sequenza delle case in vendita, la fedeltà dei due cinquantenni al loro codice, l'attesa di Genio — ognuno di questi elementi può essere letto come uno specchio d'acqua che riflette la perdita senza pretendere di superarla. Il Brion, dentro il film, sarebbe allora il momento in cui questa forma diventa visibile.\n\nVa detto subito che nessuno, nel film, insegna nulla a Giulio in quella tappa. Il Brion non funziona come dispositivo pedagogico, e leggerlo come maestro silenzioso del giovane sarebbe forzare l'opera. Opera la forma, non il contenuto. Si entra nel Brion e si esce — è la lettura proposta — sapendo, senza che nessuno lo dica, che esistono modi di tenere il limite che non sono né negazione né rassegnazione. Quale precisa torsione produca questo passaggio sul giovane, il film lascia aperto.\n\n## Genio: ciò che vincola da lontano\n\nResta da considerare il quarto amico. La sua assenza percorre l'intero film come orizzonte mai pienamente raggiunto. Atteso, atteso, atteso: il suo ritorno dall'Argentina è la tensione di sfondo che organizza le tappe del vi